{
  "$schema": "https://json-schema.org/draft/2020-12/schema",
  "$id": "https://ko-agentbench.dev/schemas/v2/task.schema.json",
  "title": "Ko-AgentBench v2 Task Schema",
  "type": "object",
  "additionalProperties": false,
  "required": [
    "schema_version",
    "task_id",
    "track",
    "level",
    "instruction",
    "available_tools",
    "golden",
    "evaluation",
    "runtime_constraints",
    "metadata"
  ],
  "properties": {
    "schema_version": {
      "type": "string",
      "pattern": "^2\\.0(\\.\\d+)?$"
    },
    "task_id": {
      "type": "string",
      "pattern": "^[A-Z0-9_-]+$"
    },
    "track": {
      "type": "string",
      "enum": [
        "A",
        "B",
        "C",
        "SAFETY"
      ]
    },
    "level": {
      "type": "integer",
      "minimum": 1,
      "maximum": 10
    },
    "locale": {
      "type": "object",
      "additionalProperties": false,
      "properties": {
        "language": {
          "type": "string",
          "default": "ko-KR"
        },
        "timezone": {
          "type": "string",
          "default": "Asia/Seoul"
        }
      }
    },
    "instruction": {
      "type": "object",
      "additionalProperties": false,
      "required": [
        "primary"
      ],
      "properties": {
        "primary": {
          "type": "string",
          "minLength": 1
        },
        "variants": {
          "type": "array",
          "items": {
            "type": "string"
          },
          "default": []
        }
      }
    },
    "available_tools": {
      "type": "array",
      "minItems": 1,
      "items": {
        "type": "object",
        "additionalProperties": false,
        "required": [
          "name",
          "input_schema"
        ],
        "properties": {
          "name": {
            "type": "string"
          },
          "description": {
            "type": "string"
          },
          "input_schema": {
            "type": "object"
          }
        }
      }
    },
    "conversation": {
      "type": "object",
      "additionalProperties": false,
      "properties": {
        "turns": {
          "type": "array",
          "items": {
            "type": "object",
            "additionalProperties": false,
            "required": [
              "turn",
              "role",
              "content"
            ],
            "properties": {
              "turn": {
                "type": "integer",
                "minimum": 1
              },
              "role": {
                "type": "string",
                "enum": [
                  "user",
                  "assistant",
                  "tool"
                ]
              },
              "content": {
                "type": "string"
              }
            }
          }
        },
        "context_tests": {
          "type": "array",
          "default": [],
          "items": {
            "type": "object",
            "additionalProperties": false,
            "required": [
              "expected_action"
            ],
            "properties": {
              "turn": {
                "type": "integer",
                "minimum": 1
              },
              "trigger": {
                "type": "string"
              },
              "should_remember": {
                "type": "string"
              },
              "expected_action": {
                "type": "object",
                "additionalProperties": false,
                "required": [
                  "tool"
                ],
                "properties": {
                  "tool": {
                    "type": "string"
                  },
                  "args": {
                    "type": "object",
                    "default": {}
                  }
                }
              }
            }
          }
        }
      }
    },
    "golden": {
      "type": "object",
      "additionalProperties": false,
      "required": [
        "required_tools",
        "action_graph",
        "expected_answer"
      ],
      "properties": {
        "required_tools": {
          "type": "array",
          "items": {
            "type": "string"
          }
        },
        "optional_tools": {
          "type": "array",
          "items": {
            "type": "string"
          },
          "default": []
        },
        "action_graph": {
          "type": "object",
          "additionalProperties": false,
          "required": [
            "nodes",
            "edges",
            "min_steps"
          ],
          "properties": {
            "nodes": {
              "type": "array",
              "items": {
                "type": "object",
                "additionalProperties": false,
                "required": [
                  "id",
                  "tool"
                ],
                "properties": {
                  "id": {
                    "type": "string"
                  },
                  "tool": {
                    "type": "string"
                  },
                  "args": {
                    "type": "object",
                    "default": {}
                  }
                }
              }
            },
            "edges": {
              "type": "array",
              "items": {
                "type": "object",
                "additionalProperties": false,
                "required": [
                  "from",
                  "to",
                  "mapping"
                ],
                "properties": {
                  "from": {
                    "type": "string"
                  },
                  "to": {
                    "type": "string"
                  },
                  "mapping": {
                    "type": "array",
                    "items": {
                      "type": "object",
                      "additionalProperties": false,
                      "required": [
                        "from_field",
                        "to_arg"
                      ],
                      "properties": {
                        "from_field": {
                          "type": "string"
                        },
                        "to_arg": {
                          "type": "string"
                        }
                      }
                    }
                  }
                }
              }
            },
            "min_steps": {
              "type": "integer",
              "minimum": 1
            }
          }
        },
        "expected_answer": {
          "type": "object",
          "additionalProperties": false,
          "required": [
            "required_fields"
          ],
          "properties": {
            "required_fields": {
              "type": "array",
              "items": {
                "type": "string"
              }
            },
            "forbidden_claims": {
              "type": "array",
              "items": {
                "type": "string"
              },
              "default": []
            }
          }
        }
      }
    },
    "evaluation": {
      "type": "object",
      "additionalProperties": false,
      "required": [
        "deterministic_checks",
        "judge_checks",
        "metric_weights"
      ],
      "properties": {
        "deterministic_checks": {
          "type": "array",
          "items": {
            "type": "string",
            "enum": [
              "TRF1",
              "ArgF1",
              "ExecSR",
              "RecoverSR",
              "StepEff",
              "GroundAns",
              "CtxRecall",
              "PolicySafe"
            ]
          }
        },
        "judge_checks": {
          "type": "array",
          "items": {
            "type": "string"
          },
          "default": []
        },
        "metric_weights": {
          "type": "object",
          "minProperties": 1,
          "patternProperties": {
            "^[A-Za-z0-9@_]+$": {
              "type": "number",
              "minimum": 0.0,
              "maximum": 1.0
            }
          },
          "additionalProperties": false
        }
      }
    },
    "runtime_constraints": {
      "type": "object",
      "additionalProperties": false,
      "required": [
        "max_steps",
        "timeout_sec"
      ],
      "properties": {
        "max_steps": {
          "type": "integer",
          "minimum": 1
        },
        "timeout_sec": {
          "type": "integer",
          "minimum": 1
        },
        "max_tool_calls": {
          "type": "integer",
          "minimum": 1
        }
      }
    },
    "error_injection": {
      "type": "object",
      "additionalProperties": false,
      "properties": {
        "enabled": {
          "type": "boolean",
          "default": false
        },
        "policy": {
          "type": "string",
          "enum": [
            "none",
            "single_failure",
            "intermittent_failure"
          ],
          "default": "none"
        },
        "targets": {
          "type": "array",
          "items": {
            "type": "string"
          },
          "default": []
        }
      }
    },
    "metadata": {
      "type": "object",
      "additionalProperties": false,
      "required": [
        "domain",
        "difficulty",
        "author",
        "created_at"
      ],
      "properties": {
        "domain": {
          "type": "string"
        },
        "difficulty": {
          "type": "string",
          "enum": [
            "easy",
            "medium",
            "hard",
            "expert"
          ]
        },
        "author": {
          "type": "string"
        },
        "created_at": {
          "type": "string",
          "format": "date-time"
        },
        "tags": {
          "type": "array",
          "items": {
            "type": "string"
          },
          "default": []
        }
      }
    }
  }
}
